{
  "title": "DuckDB TPC-H Benchmark (sample 100)",
  "output": "results/duckdb_tpch",
  "repetitions": 1,
  "warmup": 0,
  "systems": [
    {
      "title": "DuckDB",
      "dbms": "duckdb",
      "parameter": {},
      "settings": {}
    }
  ],
  "parameter": {
    "scale": 10
  },
  "settings": {
    "timeout": 5,
    "global_timeout": 3600,
    "fetch_result": true,
    "fetch_result_limit": 1000,
    "query_seed": 12345,
    "query_limit": 200
  },
  "benchmarks": [
    {
      "name": "tpch",
      "scale": 10,
      "query_dir": "queries_sqlstorm_v1.0"
    }
  ]
}


