{
  "title": "StarRocks TPC-H Benchmark",
  "output": "results/starrocks_tpch",
  "repetitions": 3,
  "warmup": 1,
  "systems": [
    {
      "title": "StarRocks",
      "dbms": "starrocks",
      "parameter": {
        "buffer_size": "8G",
        "worker_threads": 8,
        "index": "primary"
      },
      "settings": {}
    }
  ],
  "parameter": {
    "scale": 1
  },
  "settings": {
    "timeout": 300,
    "global_timeout": 3600,
    "fetch_result": true,
    "fetch_result_limit": 1000
  },
  "benchmarks": [
    {
      "name": "tpch",
      "scale": 1
    }
  ]
}
