{
  "title": "StarRocks TPC-H Benchmark (sample 1000)",
  "output": "results/starrocks_tpch1000",
  "repetitions": 1,
  "warmup": 0,
  "systems": [
    {
      "title": "StarRocks",
      "dbms": "starrocks",
      "parameter": {
        "buffer_size": "8G",
        "worker_threads": 8,
        "index": "primary"
      },
      "settings": {}
    }
  ],
  "parameter": {
    "scale": 1
  },
  "settings": {
    "timeout": 5,
    "global_timeout": 3600,
    "fetch_result": true,
    "fetch_result_limit": 1000,
    "query_seed": 12345,
    "query_limit": 1000
  },
  "benchmarks": [
    {
      "name": "tpch",
      "scale": 10,
      "query_dir": "queries_sqlstorm_v1.0"
    }
  ]
}


